Category,Question,Answer
Öğrenci Kulüpleri,Etkinliğimiz için sponsor alabilir miyiz?, Üniversitemiz ve öğrencilerimize fayda sağlayabilecek yasal şartları uygun kurum ve kuruluşlardan sponsor alabilirsiniz. Etkinlik öncesi hazırlayacağınız Sponsorluk dosyasını Kulüpler Koordinatörlüğü’ne onaylatmanız gerekmektedir.
Öğrenci Kulüpleri,Öğrenci kulüplerine sağlanan imkanlar nelerdir?," Kulüpler akademik yılın başında hazırlayıp sunacakları faaliyet planına göre maddi ve manevi olarak desteklenir. Tanıtım yapma, üye kaydetme, etkinlik yapma, ulaşım ve konaklama sağlama olanaklarına sahiptir."
Psikolojik Danışmanlık,Psikolojik Danışmanlık Birimi’nin hizmetleri ücretli mi?, Psikolojik Danışmanlık Birimi’nin tüm çalışmaları yalnızca İstanbul Bilgi Üniversitesi öğrenci ve personeline açık ve ücretsizdir.
Psikolojik Danışmanlık,Psikolojik Danışmanlık Birimi’nden nasıl randevu alabilirim?," Psikolojik Danışmanlık Birimi, acil durumlar dışında randevu ile çalışır. Randevu almak için web sayfasındaki Başvuru Formu'nu doldurup e-posta eki olarak ya da elden bize ulaştırabilirsiniz. Acil durumlarda mesai saatleri içinde doğrudan PDB ofislerine gelmeniz, mesai saatleri dışında en yakın sağlık kuruluşuna ulaşmanız önerilir. Ayrıntılı bilgi için; http://www.bilgi.edu.tr/tr/bilgide-yasam/saglik-hizmetleri/psikolojik-danismanlik/giris/?psikolojik-danismanlik-menu"
Psikolojik Danışmanlık,Psikolojik Danışmanlık Birimi’nde anlatacaklarım başkaları ile paylaşılır mı?," Psikolojik Danışmanlık Birimi’nde, kişisel bilgiler ve görüşme içerikleri, siz izin vermediğiniz sürece, kesinlikle kimseyle paylaşılmaz. Ancak, sizin veya bir başkasının zarar görmesi ya da hayati tehlike altında olması durumunda gerekli kişilerle temasa geçilebilir. Bu koşullar altında dahi, başka birisi aranmadan önce sizden onay alınmaya çalışılır."
Psikolojik Danışmanlık,"BİLGİ mezunuyum, Psikolojik Danışmanlık Birimi’nden yararlanabilir miyim?"," Mezunlarımız Psikolojik Danışmanlık Birimi’nin bireysel görüşme hizmetinden ve grup çalışmalarından faydalanamazlar, ancak güvenilir ve uygun ücretli yardım kaynaklarına yönlendirme desteği verebiliriz."
Spor,Kuştepe Spor Salon'nun programına nereden ulaşabilirim?, 0212-3116366 no’lu telefondan Spor Birimi sorumlusu Aslı Ertunç’tan ulaşabilirsiniz.
Spor,Kuştepe Spor Salonunu nasıl kullanabilirim?," Salonumuz Pazar günü hariç olmak üzere, hafta içi 08.30-21.00, Cumartesi günleri ise 08.30-15.00 arasında hizmet vermektedir. Spor Birimi sorumlusu Aslı Ertunç’tan e-mail veya telefon ile randevu alabilirsiniz. (asli.ertunc@bilgi.edu.tr / 0212-311 6256)"
Spor,Kuştepe Spor Salonu'nu rezerve ederken nelere dikkat etmeliyim?, Rezervasyonlar saat 17.00 den sonraki kullanımlar için gereklidir. Almış olduğunuz randevulara mazeretsiz olarak gelmemeniz halinde tekrar rezervasyon yapılamayacağını hatırlamak isteriz.
Spor,Spor tesislerimizin imkanları nelerdir?," Kuştepe Kampüsü’ndeki Spor Salonu’nda basketbol, voleybol, hentbol ve masa tenisi oynayabilir, fitness aletlerini ücretsiz kullanabilirsiniz. Spor Birimi’nden randevu almanız gerekiyor. Dolapdere Kampüsü’nde bulunan ve özel bir işletmeye ait olan yarı-olimpik havuz ve fitness salonundan üyelik sistemi ile indirimli ücretle faydalanabilirsiniz."
Spor,Dolapdere yüzme havuzu ve fitness salonu kullanım koşulları nelerdir?, 0212-3115477 no’lu telefondan bilgi alabilirsiniz.
Spor,Spor Salonu'ndan ödünç malzeme alabilir miyim?, Spor Salonu'muzdan ödünç malzeme verilmemektedir.
Spor,BİLGİ'de hangi spor takımları var?," Türkiye Üniversite Sporları Federasyonu’na bağlı ve başarılı faaliyetler gösteren kadın voleybol, yüzme, masa tenisi, tenis, Amerikan futbolu, triatlon, yelken, kayak- snowboard, futbol, salon futbolu, frizbi, ragbi, flag futbol, kürek, sutopu takımlarımız bulunmaktadır."
Spor,Spor takımları seçmeleri ne zaman olur?," Her akademik yılın başında, dersler başladıktan sonra ilk 1 ay içinde ihtiyaç duyulan branşlarda seçmeler yapılır ve duyuruları tüm kampüslerde asılır, web sayfasından duyurulur."
Spor,Spor takımlarında kimler yer alabilir?, Spor yapmaya elverişli ve takımlarımızın yer aldığı ligde oynayabilecek düzeyde sporcular takımlara katılabilirler.
Spor,Spor bursu almanın şartları nelerdir?," İstanbul Bilgi Üniversitesi’nin üniversitelerarası müsabakalara katılım sağladığı branşlarda milli takım seviyesine yükselmiş veya milli olmasa bile üniversite takımına seçildikten sonra yüksek performans göstermiş olan öğrencilere, Spor Koordinatörlüğü’nün teklifi ve Burs Komitesi’nin tespit edeceği oranlarda karşılıksız ‘sporcu bursu’ verilebilir. Bursun verilmesindeki esas, söz konusu öğrencinin eğitim başarısı öncelikli olmak üzere, kendi branşındaki üniversite takımında İstanbul Bilgi Üniversitesi’ni temsil etmesidir. Burs verilecek branşlar, Spor Birimi’nin görüşü alınarak, Burs Komitesi tarafından belirlenir. Sporcu bursu İngilizce Hazırlık Programı'nda 2 yıl ( Öğrenim dili ingilizce olan programlar için geçerlidir), lisans programlarında 4 yıl, önlisans programlarında 2 yıl geçerlidir ve Yaz Okulu'nu kapsamaz. Not ortalaması 2.00 altına düşerse kesilir."
Uluslararası Fırsatlar,Eğitim dili olarak hangi dil kullanılır?," Hukuk Fakültesi,Adalet Meslek Yüksekokulu, Sağlık Bilimleri Meslek Yüksekokulu dışında, İstanbul Bilgi Üniversitesi eğitim dili İngilizcedir."
Uluslararası Fırsatlar,Lisans programının süresi nedir?, Lisans programının süresi İngilizce hazırlık sınıfı (gerek duyulması halinde) hariç 4 akademik yıldır.
Uluslararası Fırsatlar,Yüksek Lisans programının süresi nedir?," Yüksek Lisans programının süresi İngilizce hazırlık sınıfı (gerek duyulması halinde) hariç, 3 ila 6 akademik yarıyıldır."
Uluslararası Fırsatlar,Uluslararası Öğrenci Durumundan yararlanabildiğimi nasıl doğrulayabilirim?," Türk Yüksek Öğretim Kurulu (YÖK) web sayfasına ek olarak, ek bilgiler burada detaylandırılabilir."
Uluslararası Fırsatlar,Uluslararası Öğrenci çalışabilir mi?, Uluslararası Öğrenciler mevcut mevzuatlar gereği kampüs içinde / dışında istihdam edilemez.
Uluslararası Fırsatlar,Lise diploması denklik mektubunu nasıl alınır ?, Ek ayrıntılar İl Eğitim Müdürlüğü web sayfasında bulunabilir.
Uluslararası Fırsatlar,Öğrenim Vizesi nasıl alınır?, Uluslararası Öğrenciler kendi ülkelerinde bulunan en yakın Türk Büyükelçiliği / Konsolosluğuna başvurarak 'Öğrenim Vizesi ' prosedürü ve işlem süresi ile ilgili bilgi alabilirler.
Uluslararası Fırsatlar,İkamet izni nasıl alınır?," Kayıt tamamlandıktan sonra, uluslararası öğrenci Türkiye'de geldikten ve 30 gün içinde 'ikamet izni' başvurusu yapmalıdır. Randevu online olarak Emniyet Müdürlüğü Yabancılar Şube Müdürlüğü web sayfasından alınabilir. Detaylar kayıt sırasında sağlanacaktır."
Uluslararası Fırsatlar,İstanbul Bilgi Üniversitesinde konaklama var mı?," Evet, İstanbul Bilgi Üniversitesi, burada ayrıntıları verildiği gibi konaklama sağlar."
